{
  "$schema": "https://json-schema.org/draft/2020-12/schema",
  "$id": "skill-rails/target/2",
  "type": "object",
  "additionalProperties": false,
  "required": ["schemaVersion", "targetId", "entry", "imports"],
  "properties": {
    "schemaVersion": {"const": 2},
    "targetId": {"type": "string", "pattern": "^[a-z0-9]+(?:-[a-z0-9]+)*$"},
    "entry": {"type": "string", "minLength": 1},
    "imports": {"type": "array", "items": {"type": "string", "pattern": "^[A-Za-z][A-Za-z0-9_-]*$"}, "uniqueItems": true},
    "references": {"type": "array", "items": {"type": "string", "minLength": 1}, "uniqueItems": true},
    "tools": {"type": "array", "items": {"type": "string", "pattern": "^[a-z0-9]+(?:-[a-z0-9]+)*$"}, "uniqueItems": true},
    "record": {
      "type": "object",
      "additionalProperties": false,
      "required": ["domainConfig", "domainConfigSchema", "renderer", "answerContract", "declaredInputs", "declaredOutput"],
      "properties": {
        "domainConfig": {"type": "string", "minLength": 1},
        "domainConfigSchema": {"type": "string", "minLength": 1},
        "renderer": {"type": "string", "minLength": 1},
        "answerContract": {"type": "string", "minLength": 1},
        "declaredInputs": {"type": "array", "minItems": 1, "items": {"type": "string"}, "uniqueItems": true},
        "declaredOutput": {"type": "string", "minLength": 1}
      }
    },
    "headingIndex": {"type": "string", "pattern": "^[A-Za-z][A-Za-z0-9_-]*$"},
    "embeddedCoreTooling": {"const": "authoring-cli-v1"}
  }
}
